{
  "schemaVersion": 1,
  "kind": "omadecor-decoration",
  "id": "omadecor/raised-edge",
  "name": "Raised Edge",
  "version": "1.0.0",
  "author": {
    "name": "OmaDecor contributors"
  },
  "description": "Thin highlighted top and right edges with thicker dark bottom and left edges.",
  "requires": [
    "primitive.frame",
    "paint.solid",
    "state.focused",
    "color.oklch-derive"
  ],
  "parameters": {
    "mainColor": {
      "type": "color",
      "label": "Main color",
      "default": {
        "ref": "system.accent"
      }
    },
    "lightWidth": {
      "type": "number",
      "label": "Light edge",
      "unit": "px",
      "default": 2,
      "min": 0,
      "max": 20,
      "step": 1
    },
    "darkWidth": {
      "type": "number",
      "label": "Dark edge",
      "unit": "px",
      "default": 5,
      "min": 0,
      "max": 20,
      "step": 1
    },
    "darkening": {
      "type": "number",
      "label": "Darkening",
      "default": -0.18,
      "min": -0.4,
      "max": 0,
      "step": 0.01
    },
    "inactiveOpacity": {
      "type": "number",
      "label": "Inactive opacity",
      "default": 0.55,
      "min": 0,
      "max": 1,
      "step": 0.05
    }
  },
  "palette": {
    "main": {
      "ref": "param.mainColor"
    },
    "dark": {
      "derive": {
        "from": {
          "ref": "palette.main"
        },
        "space": "oklch",
        "lightness": {
          "ref": "param.darkening"
        }
      }
    }
  },
  "appearance": {
    "opacity": 1
  },
  "layers": [
    {
      "id": "main-frame",
      "type": "frame",
      "placement": "outside",
      "join": "square",
      "top": {
        "thickness": {
          "ref": "param.lightWidth"
        },
        "paint": {
          "type": "solid",
          "color": {
            "ref": "palette.main"
          }
        }
      },
      "right": {
        "thickness": {
          "ref": "param.lightWidth"
        },
        "paint": {
          "type": "solid",
          "color": {
            "ref": "palette.main"
          }
        }
      },
      "bottom": {
        "thickness": {
          "ref": "param.darkWidth"
        },
        "paint": {
          "type": "solid",
          "color": {
            "ref": "palette.dark"
          }
        }
      },
      "left": {
        "thickness": {
          "ref": "param.darkWidth"
        },
        "paint": {
          "type": "solid",
          "color": {
            "ref": "palette.dark"
          }
        }
      }
    }
  ],
  "variants": [
    {
      "when": {
        "focused": false
      },
      "patch": {
        "theme": {
          "opacity": {
            "ref": "param.inactiveOpacity"
          }
        }
      }
    }
  ]
}
